{
  "schema_version": "0.2",
  "task_id": "feature-packages-cli--352c85",
  "intent": "feature",
  "conclusion": "已在 packages/cli 实现 verify MVP，可读取 active task 或指定 task_id，并按最小验证矩阵给出完成门禁判断。",
  "actual_scope": [
    "packages/cli",
    "state/report/gate/audit"
  ],
  "scope_deviation": null,
  "evidence_summary": [
    {
      "type": "command_result",
      "result": "node packages/cli/bin/agent-harness.js verify --task-id feature-packages-cli--fa8677"
    }
  ],
  "remaining_risks": [
    "Node CLI 仍未迁移 state/report/gate/audit",
    "verify 当前只兼容本地 JSON state 文件，不支持远程或多后端状态源"
  ],
  "overrides_used": [

  ],
  "next_steps": [
    "实现 packages/cli 的 state MVP",
    "让 verify 与后续 Node state 命令共用状态读取层"
  ],
  "completed_at": "2026-04-03T10:56:59+08:00"
}