{
  "schema_version": "0.2",
  "task_id": "feature--agent-harness-67dc25",
  "intent": "feature",
  "conclusion": "已新增 README 与 protocol/cli 分包骨架，protocol 资源已复制到新包，Node CLI 骨架可执行。",
  "actual_scope": [
    "packages/protocol",
    "packages/cli"
  ],
  "scope_deviation": null,
  "evidence_summary": [
    {
      "type": "command_result",
      "result": "node packages/cli/bin/agent-harness.js --help"
    }
  ],
  "remaining_risks": [
    "CLI 仅为 skeleton，init/status/verify 等命令尚未迁移",
    "仓库当前不是 git repository，无法用 git status 作为常规验证手段"
  ],
  "overrides_used": [

  ],
  "next_steps": [
    "实现 packages/cli 的 init MVP",
    "继续将历史 Ruby 实现迁移到 Node CLI"
  ],
  "completed_at": "2026-04-02T22:29:56+08:00"
}