{
  "schema_version": "0.2",
  "task_id": "explore--agent-harness-fba7b3",
  "intent": "explore",
  "conclusion": "已完成发布前文档收口：根 README 改为对外 Quick Start 入口，ADR 明确 protocol/cli 发布边界，并冻结 update 不进 v0.1。",
  "actual_scope": [
    "protocol/cli"
  ],
  "scope_deviation": null,
  "evidence_summary": [
    {
      "type": "reasoning_note",
      "result": "结论：发布前应先收口文档而不是继续扩命令；README 需要改成真实可用入口，ADR 需要明确 protocol/cli 边界，并冻结 update 不进 v0.1。依据：当前 packages/cli 已有 init/status/state/verify/report/gate/audit MVP，但根 README 仍停留在 skeleton 叙事，ADR 也未明确 v0.1 的非目标。风险：如果对外继续保留旧叙事，会误导社区对安装方式、能力边界和发布承诺的判断。下一步建议：在文档收口后，再评估宿主 hooks 深化和正式发布流程。"
    }
  ],
  "remaining_risks": [

  ],
  "overrides_used": [

  ],
  "next_steps": [

  ],
  "completed_at": "2026-04-03T11:41:21+08:00"
}