{
  "schema_version": "0.2",
  "task_id": "feature-packages-cli--fa8677",
  "intent": "feature",
  "conclusion": "已在 packages/cli 实现 status MVP，可检查项目接入状态，并用退出码区分完整、警告和不完整。",
  "actual_scope": [
    "packages/cli",
    "state/verify/report"
  ],
  "scope_deviation": null,
  "evidence_summary": [
    {
      "type": "command_result",
      "result": "node /Users/lijianfeng/code/pp/agent-harness/packages/cli/bin/agent-harness.js status"
    }
  ],
  "remaining_risks": [
    "Node CLI 仍未迁移 verify/state/report/gate/audit",
    "status 当前只检查接入健康，不读取完整任务运行时状态"
  ],
  "overrides_used": [

  ],
  "next_steps": [
    "实现 packages/cli 的 verify 或 state MVP",
    "补 status 的 update/版本检查能力"
  ],
  "completed_at": "2026-04-02T22:42:00+08:00"
}