{
  "schema_version": "0.2",
  "task_id": "feature-packages-cli--46c6f0",
  "intent": "feature",
  "conclusion": "已在 packages/cli 实现 init MVP，支持项目/宿主检测、harness.yaml 生成、规则注入、模板复制、protocol-only 与 dry-run。",
  "actual_scope": [
    "packages/cli",
    "state/gate/report"
  ],
  "scope_deviation": null,
  "evidence_summary": [
    {
      "type": "command_result",
      "result": "node /Users/lijianfeng/code/pp/agent-harness/packages/cli/bin/agent-harness.js init --host claude-code"
    }
  ],
  "remaining_risks": [
    "Node CLI 仍未迁移 status/verify/state/report/gate/audit",
    "宿主 hooks 目前只覆盖 Claude Code 的最小写入样板"
  ],
  "overrides_used": [

  ],
  "next_steps": [
    "实现 packages/cli 的 status MVP",
    "继续迁移 Ruby CLI 的状态与验证能力"
  ],
  "completed_at": "2026-04-02T22:38:18+08:00"
}