{
  "schema_version": "0.2",
  "task_id": "feature--packages-cli-4ba292",
  "intent": "feature",
  "conclusion": "已在 packages/cli 实现 report MVP，可复用 verify 门禁生成报告并将任务收尾到 close/done。",
  "actual_scope": [
    "packages/cli",
    "gate/audit"
  ],
  "scope_deviation": null,
  "evidence_summary": [
    {
      "type": "command_result",
      "result": "node /Users/lijianfeng/code/pp/agent-harness/packages/cli/bin/agent-harness.js report --task-id state-mvp-demo --conclusion state/report链路验证完成"
    }
  ],
  "remaining_risks": [
    "Node CLI 仍未迁移 gate/audit",
    "report 当前未接入 overrides_used 的审计来源"
  ],
  "overrides_used": [

  ],
  "next_steps": [
    "实现 packages/cli 的 gate MVP",
    "补 Node audit 层并让 report 读取 overrides_used"
  ],
  "completed_at": "2026-04-03T11:18:48+08:00"
}